"title","channel","url","type","linked_to","transcription","likes","comments","views","published_at"
"Se o fim da ESCALA 6x1 for aprovado a BOLSA acaba? É o fim?","Vida Plena - Gianini Cochize","https://www.youtube.com/watch?v=i37yGA3RUm4","Principal","Entenda o que propõe a PEC do fim da escala 6x1 | CNN NOVO DIA // Fim da escala 6x1: projeto domina redes sociais e pressiona deputados | SBT Brasil (11/11/24) // 6x1: entenda o projeto que pede o fim da escala 6x1 | Leonardo Sakamoto // O Fim da Escala 6 X 1 // ninguém aguenta mais a ESCALA 6x1 // Se o fim da escala 6x1 for aprovado a bolsa acaba? É o fim? // O Fim da Escala 6x1 vai Quebrar a Economia do Brasil // Fim da escala 6x1 é &#39;bastante prejudicial&#39; ao trabalhador, diz presidente do Banco Central // Redução da jornada de trabalho: PEC que acaba com a escala 6X1 está em debate // FIM DA ESCALA DE TRABALHO 6x1: o que está sendo proposto? Como começou o movimento? ESTADÃO EXPLICA // Proposta de fim da escala 6x1 de trabalho causa mobilização nas redes sociais // Escala 6x1: debate sobre jornada de trabalho movimenta Congresso e redes sociais // REFUTANDO QUEM É CONTRA O FIM DA ESCALA 6X1 | FÁCIL DEMAIS // Fim da escala 6x1: você é a favor ou contra? 👷🏽⏰ #trabalho #profissão #dinheiro #negócios #shorts // Como o fim da escala 6x1 pode impactar o mercado de trabalho // FIM DA ESCALA 6X1:  É POSSÍVEL DAR MAIS FOLGA PARA O TRABALHADOR?  | PALAVRA ABERTA // A escala 6x1 vai acabar? Por que o assunto ganhou os holofotes // Escala 6x1: PEC pelo fim da jornada de trabalho 6x1 chega a 134 assinaturas; são necessárias 171 // URGENTE: FIM DA ESCALA 6X1 EXPLICADO ENTENDA DE UMA VEZ POR TODAS // A QUEDA DA ESCALA 6x1: LEO PICON vs ERIKA HILTON? (Precisamos falar sobre o Brasil) // URGENTE: A Escala 6x1 vai acabar? // FIM DA ESCALA 6x1 | Analisando pontos importantes // Especialista em Direito do Trabalho explica consequências do fim da escala 6x1 // NEGARAM O FIM DA ESCALA 6X1!!? #clt #meme #memes #engraçado // Redução da jornada de trabalho: PEC que acaba com a escala 6X1 está em debate // Escala 6x1: Redução de jornada é tendência, mas, por meio de lei, eleva informalidade, diz Landim // Escala 6x1: uma nova era de avaliação no trabalho ou risco à Justiça Trabalhista? // FIM DA ESCALA 6X1: Katia começa a trabalhar no Supermercado e já se mete em confusão: CLT // TRABALHADOR EXAUSTO FAZ DESABAFO SOBRE ESCALA 6X1 // ESCALA 6x1: A ROTINA QUE DESTRÓI MILHÕES de BRASILEIROS (Vídeo Irrefutável) // O FIM DA JORNADA 6x1... TUDO O QUE VOCÊ PRECISA SABER! // Escala 6x1 e os impactos na vida do trabalhador brasileiro | Papo Rápido | GNT // Fim da escala 6x1 | Parte 1 // Por que a proposta do fim da escala 6x1 é a 4x3? // PEC da escala 6x1: Deputada Erika Hilton explica proposta em entrevista exclusiva | SBT News // DEUS É CONTRA A ESCALA 6x1? OS 10 MANDAMENTOS PROÍBEM? // 🚨ALERTA: FIM DA ESCALA 6x1 COLOCARÁ EM XEQUE OS EMPREGOS NO BRASIL? // A ESCALA 6x1 VAI ACABAR? | PAUTA QUENTE // FIM DA ESCALA 6x1: Any Ortiz explica sua posição sobre PEC | Timeline // ESPOSA DE DEYVERSON OPINA SOBRE ESCALA 6X1: ‘SERÁ QUE A CULPA É DO SEU CHEFE?’ // A PEC do fim da ESCALA 6X1 vai ARRUINAR sua vida // 🟡🔵 TRABALHO ESCALA 6x1. FEZ UM ESTRAGO NA MINHA VIDA // ESCALA 6X1 Saiba o que já está em vigor! // FIM DA ESCALA 6X1: ENTENDA A DISCUSSÃO! // PEC do fim da escala 6x1: Manifestações de apoio devem acontecer em 6 capitais | O POVO NEWS // ESCALA 6X1: Impactos no CORPO e na MENTE | ANA BEATRIZ // JAMAIS TRABALHE NA ESCALA 6x1 // O que é a PEC da escala 6x1 // Feliciano sobre Escala 6x1: &quot;Nos EUA, todos trabalham até a exaustão pra ver prosperidade e riqueza&quot; // Escala 6x1: PEC deve ter as assinaturas suficientes nesta semana, diz deputada Erika Hilton // Fim da escala 6x1 | Entenda agora // O fim da Escala 6x1: Como essa mudança afeta Pequenos Empresários e Trabalhadores // PELO FIM DA ESCALA 6X1 // Alexandre Garcia: PEC que acaba com escala de trabalho 6x1 é burra // Fim da escala 6x1: Entenda como funciona o modelo atual e o que PEC pode mudar // PEC pelo fim da escala 6x1 atinge assinaturas e já pode tramitar no Congresso // Escala 6x1: Brasil está entre os países com jornada mais excessiva, diz advogada trabalhista // CLEITINHO E JORGE SEIF DISCUTEM SOBRE ESCALA 6X1 NO SENADO // FIM DA ESCALA 6X1: EMPRESÁRIOS ABREM O JOGO SOBRE O FUTURO DA ECONOMIA | BRASIL À BEIRA DO COLAPSO? // COMO O FIM DA ESCALA 6X1 PODE IMPACTAR EMPRESAS E TRABALHADORES? #FN // Escala 6x1 - O Jovem quer SABER!!! // PEC do fim da escala 6x1 é uma farsa // SEU OSMAR E A ESCALA 6X1 DO ROBERTO ELE TA CANSADO DE TRABALHAR TENTE NÃO RIR 🤣 #humor #memes 🤠 // Senador Cleitinho (PL-MG) discursa em apoio a PEC do fim da escala 6x1 | O POVO NEWS // FIM DA ESCALA 6x1 PODE DESTRUIR A ECONOMIA BRASILEIRA // A ESCALA 6X1 TEM QUE ACABAR? // ESCALA 6x1: Será o fim desse modelo de trabalho? // NANDO MOURA CONTRA A ESCALA 6X1 // O POVO FALA: FIM DA ESCALA 6X1, QUAL A OPINIÃO DO TRABALHADOR? // Escala 6x1: eu sou contra! // ESCALA 6X1 NÃO É VIDA! PRECISAMOS FALAR SOBRE ISSO // Fim da escala 6x1 e a jornada de trabalho // Escala 6x1: A Escravidão dos Tempos Modernos! // ESCALA 6X1: A VERDADE QUE NINGÉM TE CONTA // PEC do Fim da Escala 6x1: O Que Muda para os Trabalhadores? // A ESCALA 6x1 TEM QUE ACABAR - MURILO REAGE (Cortes da Live do Suco de Brasil) // Será o fim da escala 6x1? O que muda? A bolsa vai acabar? - com Ben Zruel // FIM DA ESCALA 6x1: por que esse tipo de trabalho tem que acabar? // Afinal, o que é a Escala 6x1 ? #noticias #direitotrabalho #escala6x1 #6x1 #pec  #direitotrabalhador // Escala 6x1 em Debate: Famosos como Leo Picon, Jade, Luana Piovani e Gil do Vigor opinam sobre a PEC // Fiz uma comparação da escala 6X1 do trabalhador com a do político. // FIM DA ESCALA 6x1 #hamletpng #shorts // tem como fazer a ESCALA 6X1 ser MENOS PIOR? // Como SAIR da ESCALA 6X1 para sempre // tentando SER FELIZ mesmo na ESCALA 6X1! #curiosidades #trabalho // FIM DA ESCALA 6X1: VALE A PENA PARA O EMPRESÁRIO? | CORTES // FIM DA ESCALA 6X1: ENTENDA A PROPOSTA ABSURDA QUE PODE DESTRUIR O BRASIL! // 5 RISCOS da ESCALA 6x1 | DANDO O FURO // CEROL DAR SUA OPINIÃO SOBRE A ESCALA 6X1 // FIM DA ESCALA 6X1 // DESABAFO DA ESCALA 6X1 // ESCALA 6X1: COMO É TRABALHAR NO SUPERMERCADO // Fim da escala 6x1 // ZEUS REAGE: A ESCALA 6X1 VAI ACABAR COM A BOLSA // A escala 6x1 vai continuar e não haverá mudanças // A verdade sobre CLT e a escala 6x1(as empresas não querem que você saiba disso) // 2 passos para TANKAR e SAIR da ESCALA 6x1 // 3 trabalhos para fugir da escala 6x1 #trabalho#work#escala#6x1 // 1° DE MAIO! PELO FIM DA ESCALA 6x1! // RENAN FALANDO SOBRE A ESCALA 6X1 KKKKKKKKKKKKKKKKKKKKKKKKKKKKKKKKKKKKKKKKKKKKKK // Escala 6x1 em discussão na Câmara: Como a esquerda vai desempregar ainda mais brasileiros. // Cleitinho confronta aliados e quer Fim da Escala 6x1- Nikolas Ferreira rebate críticas // Fim da escala 6x1 e o Deputado Marco Feliciano // Como sair da escala 6x1 e começar no Youtube (sem passar fome) // Marco Feliciano é contra o fim da escala 6x1 // VOCÊ É CONTRA A ESCALA 6x1? 🤔 #shorts #short #escala6x1 #escala6x1não #6x1 #clt  #trabalho #viral // TRABALHAR NA ESCALA 6X1 VAI ARRUINAR SUA VIDA? (1 DE 2) - REACT @mbcnate // É o fim da escala 6x1? // Escala 6x1 #shorts  #camaçari #6x1 #Escala6x1 // Escala 6x1 tem que acabar, os piores argumentos. // DESABAFO ESCALA 6X1: A REALIDADE DOS TRABALHADORES BRASILEIROS! | REACT. Luideverso // Escala 6x1 voce concorda? #6x1 #escala5x2 #clt #trabalho // Fim da escala 6x1! Trabalhadores unidos! // Escala 6x1 ESCRAVIDÃO moderna! (Jovem fuja disso) // FIM DA ESCALA 6X1 #6x1 #escala6x1 #clt // Escala 6x1 - Parte 1  #humor #cenas #comedia #6x1 #escala6x1 // A escala 6x1 é desumana! - Pt 2 @paulovcoach #paulovieiracortes #clt #6x1 #escala6x1 #trabalho // Escala 6X1 #direito #escala6x1 #6x1 #bolsonaro #lula #direita #esquerda #trabalho #trabalhadores // 6X1 - A ESCALA DE TRABALHO DO INFERNO // Escala 6x1 part2 // A ESCALA 6x1 ESTÁ ACABANDO COM VOCÊ? // Desabafo de um jovem trabalhador na escala 6x1 // Escala 6x1 // Fim da escala 6x1 #escala6x1 // #noticias #escala #6x1 #pec #constituicaofederal #fim // Cerol fala sobre a Escala 6x1 Deve ou não deve acabar ? #cerol #escala #6x1 #clt // Fim da escala 6x1 // ESCALA 6x1: PAVANATO vs FEMINISTA #feminista #entertainment #escala #pavanato #6x1 // ","transcriptions.txt","2231","539","52264","2024-11-15"
"SUBCELEBRIDADE, MOURÃO E NIKOLAS SÃO A FAVOR DA ESCALA 6X1 E IRRITAM SEGUIDORES | Galãs Feios","Galãs Feios","https://www.youtube.com/watch?v=D1SBSo4QzkY","Principal","URGENTE: A Escala 6x1 vai acabar? // Léo Picon REAGE após &#39;massacre&#39; por fala sobre ESCALA 6x1 e diz que não é contra os trabalhadores // O FIM DA ESCALA 6X1 (ninguém quer trabalhar😢) // Léo Picon defende escala 6x1 e internautas relembram oq ele fez com Brino, Tiago responde Petry // Estou revoltado! com essa escala 6x1 (O início de tudo) // ","transcriptions.txt","12650","842","94444","2024-11-11"
"E ainda trabalha em escala 6x1 😢","Gabriel Bartz","https://www.youtube.com/watch?v=-uh4eRh9kSo","Principal","","transcriptions.txt","84985","267","669617","2024-11-15"
"A ESCALA 6X1 FOI ABOLIDA!?! #trabalho #clt #escala6x1","Laestro","https://www.youtube.com/watch?v=0NNGYdrBitg","Principal","Escala 6x1: debate sobre jornada de trabalho movimenta Congresso e redes sociais // Debate sobre escala 6X1 reorganizou a classe trabalhadora, diz autora da PEC | CNN 360º // Empresário: Como o fim da escala 6x1, negócios vão fechar | CNN 360° // Especialista em Direito do Trabalho explica consequências do fim da escala 6x1 // Fim da escala 6x1 virou tema &#39;incontornável&#39; no Congresso após pressão da sociedade, diz Boulos // Fim da escala 6x1? PEC propõe diminuição da jornada de trabalho // Fim da escala 6x1: Entenda como funciona o modelo atual e o que PEC pode mudar // Escala 6x1: Como surgiu o debate sobre o assunto? #trabalhadores #6x1 #direitostrabalhistas // Escala 6x1: eu sou contra! // A escala 6x1 vai continuar e não haverá mudanças // VOCÊ É CONTRA A ESCALA 6x1? 🤔 #shorts #short #escala6x1 #escala6x1não #6x1 #clt  #trabalho #viral // Estou revoltado! com essa escala 6x1 (O início de tudo) // Escala 6x1 voce concorda? #6x1 #escala5x2 #clt #trabalho // ","transcriptions.txt","94780","1983","585692","2024-11-13"
"Trabalhadores fazem greve contra escala 6x1","Rede TVT","https://www.youtube.com/watch?v=KaYYWH0Eyzw","Principal","IA News: Funcionários da Pepsico Brasil pedem fim da escala 6x1; Samy Dana analisa // ","transcriptions.txt","44","11","574","2024-11-28"
"Gustavo Gayer detona Fim da Escala 6x1 de trabalho proposta por Erika Hilton do PSOL","Cristão também pensa!","https://www.youtube.com/watch?v=MGHK7UfWM9k","Principal","GAYER CHAMA PEC QUE ACABA COM ESCALA 6X1 DE PEC DO &#39;DESEMPREGO&#39; // GAYER CRITICA PROJETO QUE PEDE FIM DA ESCALA 6X1: “PEC DO DESEMPREGO” // Escala 6x1: PEC deve ter as assinaturas suficientes nesta semana, diz deputada Erika Hilton // PEC do fim da escala 6x1 é uma farsa // Fim da escala 6x1: Entenda projeto apresentado por Erika Hilton que agita redes sociais |O POVO NEWS // ABSURDO! Proposta de Erika Hilton para escala 6x1 avança sem calcular riscos econômicos! // ","transcriptions.txt","1258","378","12584","2024-11-11"
"PEC que prevê fim da escala 6x1 ainda precisa de assinaturas e agita a Câmara dos Deputados","O POVO","https://www.youtube.com/watch?v=fJJsEFgXGN0","Principal","Fim da escala 6x1: assinaturas necessárias protocolar PEC é atingida | SBT Brasil (13/11/24) // Redução da jornada de trabalho: PEC que acaba com a escala 6X1 está em debate // Fim da escala 6x1? Veja o que pode mudar na jornada de trabalho // PEC pelo fim da escala 6x1 consegue assinaturas para ser protocolada na Câmara, diz Erika Hilton // FIM DA ESCALA 6X1:  É POSSÍVEL DAR MAIS FOLGA PARA O TRABALHADOR?  | PALAVRA ABERTA // Erika Hilton espera ter apoio do governo para fim da escala 6x1 | LINHA DE FRENTE // FIM DA ESCALA DE TRABALHO 6X1 &#39;IRIA ANULAR REFORMA TRABALHISTA&quot;, DIZ PRESIDENTE DO BANCO CENTRAL // Escala 6x1: uma nova era de avaliação no trabalho ou risco à Justiça Trabalhista? // Proposta do fim da escala 6x1 recebe apoio popular // PEC do fim da escala 6x1 atinge assinaturas necessárias para tramitar // PELO FIM DA ESCALA 6X1 // Fim da escala 6x1: Entenda como funciona o modelo atual e o que PEC pode mudar // PEC pelo fim da escala 6x1 atinge assinaturas e já pode tramitar no Congresso // Será o fim da escala 6x1? O que muda? A bolsa vai acabar? - com Ben Zruel // 1° DE MAIO! PELO FIM DA ESCALA 6x1! // PROPOSTA DE REDUÇÃO DA JORNADA E FIM DA ESCALA 6X1 GERA PREOCUPAÇÕES NO CONGRESSO // ","transcriptions.txt","1074","416","89133","2024-11-11"
"Leo Picon volta a se pronunciar após polêmica da escala 6x1","Metrópoles","https://www.youtube.com/watch?v=2hw6rGWmGks","Principal","Entenda o que propõe a PEC do fim da escala 6x1 | CNN NOVO DIA // ANALISANDO AS POLÊMICAS (E MEMES) SOBRE A ESCALA 6X1 | Diva Depressão // O Fim da Escala 6x1 vai Quebrar a Economia do Brasil // Fim da escala 6x1 é &#39;bastante prejudicial&#39; ao trabalhador, diz presidente do Banco Central // Escala 6x1: O Que Ninguém Te Conta Sobre Seus Direitos e o Que Pode Mudar em Breve! // Cortella e Alexandre Schwartsman analisam manifestações pelo fim da escala 6x1 // FIM DA ESCALA 6X1:  É POSSÍVEL DAR MAIS FOLGA PARA O TRABALHADOR?  | PALAVRA ABERTA // PÂNICO DISCUTE A VERDADE SOBRE A POLÊMICA ESCALA 6X1 E ANALISA TUDO! // Empresário: Como o fim da escala 6x1, negócios vão fechar | CNN 360° // Especialista em Direito do Trabalho explica consequências do fim da escala 6x1 // A ESCALA 6X1 VAI ACABAR? // Fim da escala 6x1: PEC atinge assinaturas necessárias | Chega Mais Notícias (13/11/24) // Léo picon fala a favor da ESCALA 6X1 // Escala 6x1: JADE PICON se posiciona após fala POLÊMICA do irmão; veja vídeo // Léo Picon REAGE após &#39;massacre&#39; por fala sobre ESCALA 6x1 e diz que não é contra os trabalhadores // Feliciano sobre Escala 6x1: &quot;Nos EUA, todos trabalham até a exaustão pra ver prosperidade e riqueza&quot; // Vereador eleito no Rio com proposta contra escala 6x1 celebra repercussão: ‘Sonhei com esse dia’ // Fim da escala 6x1: Entenda como funciona o modelo atual e o que PEC pode mudar // PÂNICO ANALISA NOVOS DETALHES SOBRE A POLÊMICA ESCALA 6X1 E DEBATE AO VIVO! // PEC do fim da escala 6x1 é uma farsa // FIM DA ESCALA 6X1 ! // PELO FIM DA ESCALA 6X1 ✊ // O DESABAFO DE UM TRABALHADOR ESCALA 6X1 // Escala 6x1: eu sou contra! // ESCALA 6X1 NÃO É VIDA! PRECISAMOS FALAR SOBRE ISSO // Dr. é verdade que vai acabar a escala 6x1? // Escala 6x1 - o que não te contaram // O fim da escala 6x1 é uma oportunidade política única (e o governo tá vacilando) // TREZOITAO É A FAVOR DA ESCALA 6X1? // Fim da escala 6x1 // A verdade sobre CLT e a escala 6x1(as empresas não querem que você saiba disso) // Fim da escala 6x1 e o Deputado Marco Feliciano // Fim da escala 6x1 // Estou revoltado! com essa escala 6x1 (O início de tudo) // EU SAI DA ESCALA 6X1 (TROQUEI DE EMPREGO) // ESCALA 6X1 É A ESCRAVIDÃO MODERNA DO SECULO XXI ?? [REACT] // FIM DA ESCALA 6x1 // O que não te contaram sobre o FIM DA ESCALA 6x1 // ","transcriptions.txt","51","43","3154","2024-11-13"
"Escala 6x1 vai acabar?  Governistas querem 3 dias de folga na semana","Gazeta do Povo","https://www.youtube.com/watch?v=8npBH7eiZHM","Principal","A escala 6x1 vai acabar? Por que o assunto ganhou os holofotes // NIKOLAS FERREIRA EXPLANA ESCALA 6X1, DETONA TAXAS EXCESSIVAS E QUARENTENA NA PANDEMIA; VEJA ÍNTEGRA // ESSA É A VERDADE SOBRE O FIM DA ESCALA 6X1 // Fim da escala 6x1 ganha pressão nas redes sociais e deve ser discutida no Congresso | Central Meio // PAULO KOGOS TENTA EXPLICAR PORQUE É A FAVOR DA ESCALA 6X1 | Galãs Feios // Escala 6x1: PEC chega a 134 assinaturas; morte de delator do PCC, Mauro Vieira ao vivo e+|  UOL News // ","transcriptions.txt","1444","93","12154","2024-11-11"
"ADEUS ESCALA 6X1, ADEUS SUPERMERCADO : PEDI DEMISSÃO !!","MINEIRINHO INVESTIDOR","https://www.youtube.com/watch?v=MvSgGuVWXMY","Principal","O Fim da Escala 6 X 1 // Se o fim da escala 6x1 for aprovado a bolsa acaba? É o fim? // a TRUE por trás da escala 6x1 // TRABALHADORES DA PEPSICO FAZEM A PRIMEIRA GREVE CONTRA ESCALA 6X1 NO BRASIL // TRABALHADOR EXAUSTO FAZ DESABAFO SOBRE ESCALA 6X1 // Desabafo REAL Sobre a Escala 6x1: Vale a Pena? // 🟡🔵 TRABALHO ESCALA 6x1. FEZ UM ESTRAGO NA MINHA VIDA // FIM DA ESCALA 6X1: ENTENDA A DISCUSSÃO! // VALE A PENA DESTRUIR SUA VIDA EM UM SUBEMPREGO? | ESCALA 6X1 // ESCALA 6X1 NÃO É VIDA! PRECISAMOS FALAR SOBRE ISSO // Escala 6x1: A Escravidão dos Tempos Modernos! // ESCALA 6X1: A VERDADE QUE NINGÉM TE CONTA // ZEUS REAGE: O PROBLEMA SÃO VOCÊS E NÃO A ESCALA 6X1! // A maioria do povo brasileiro quer o fim da escala 6x1 // Como SAIR da ESCALA 6X1 para sempre // Essa escala 6x1 eu não aguento mais #shorts #drama // DESABAFO DA ESCALA 6X1 // ESCALA 6X1: COMO É TRABALHAR NO SUPERMERCADO // Noubari - escala 6x1 // CLT e a ESCALA 6X1 - Fuja Disso! // ZEUS REAGE: A ESCALA 6X1 VAI ACABAR COM A BOLSA // CLT | SÓ IDIOTAS RECLAMAM DA ESCALA 6X1 // ESCALA 6x1 #shorts // Escala 6x1 em discussão na Câmara: Como a esquerda vai desempregar ainda mais brasileiros. // Como sair da escala 6x1 e começar no Youtube (sem passar fome) // DESABAFO ESCALA 6X1: A REALIDADE DOS TRABALHADORES BRASILEIROS! | REACT. Luideverso // EU SAI DA ESCALA 6X1 (TROQUEI DE EMPREGO) // VENDI MEU PC E AGORA VOU VIRAR CLT NA ESCALA 6X1 #fyb #bancos #clt #6x1 // FIM DA ESCALA 6x1 // ESCALA 6X1 | SÓ IDIOTAS E IMBECIS RECLAMAM DISSO // A escala 6x1 é o pior erro do bostil // SUPER XANDÃO REAGINDO A Escala 6x1  O Jovem quer SABER!!! // ","transcriptions.txt","6124","833","55514","2024-09-03"
"Escala 6x1 - O Jovem quer SABER!!!","Nando Moura","https://www.youtube.com/watch?v=Mq3msUqvyR0","Principal","6x1: entenda o projeto que pede o fim da escala 6x1 | Leonardo Sakamoto // Fim da escala 6x1? Veja o que pode mudar na jornada de trabalho // REFUTANDO QUEM É CONTRA O FIM DA ESCALA 6X1 | FÁCIL DEMAIS // FIM DA ESCALA 6X1 (COM ESTUDOS) • Física e Afins // URGENTE: A Escala 6x1 vai acabar? // FIM DA ESCALA 6x1 | Analisando pontos importantes // Especialista em Direito do Trabalho explica consequências do fim da escala 6x1 // NEGARAM O FIM DA ESCALA 6X1!!? #clt #meme #memes #engraçado // ESSA É A VERDADE SOBRE O FIM DA ESCALA 6X1 // Escala 6x1: Redução de jornada é tendência, mas, por meio de lei, eleva informalidade, diz Landim // A ESCALA 6X1 VAI ACABAR? // O FIM DA JORNADA 6x1... TUDO O QUE VOCÊ PRECISA SABER! // Escala 6x1 e os impactos na vida do trabalhador brasileiro | Papo Rápido | GNT // Fim da escala 6x1 | Parte 1 // PEC da escala 6x1: Deputada Erika Hilton explica proposta em entrevista exclusiva | SBT News // PEC do fim da escala 6x1: Manifestações de apoio devem acontecer em 6 capitais | O POVO NEWS // JAMAIS TRABALHE NA ESCALA 6x1 // Feliciano sobre Escala 6x1: &quot;Nos EUA, todos trabalham até a exaustão pra ver prosperidade e riqueza&quot; // Fim da escala 6x1 | Entenda agora // FIM DA ESCALA 6X1 DEIXA EXTREMA DIRETA DESORIENTADA // PELO FIM DA ESCALA 6X1 // Fim da escala 6x1: Entenda como funciona o modelo atual e o que PEC pode mudar // PEC pelo fim da escala 6x1 atinge assinaturas e já pode tramitar no Congresso // Pelo fim da escala 6x1 // DEPUTADOS QUE TRABALHAM 3X POR SEMANA ESTÃO CONTRA O FIM DA ESCALA 6x1 // COMO O FIM DA ESCALA 6X1 PODE IMPACTAR EMPRESAS E TRABALHADORES? #FN // ESCALA 6X1 e fim do concurso de CARREIRA! Concurso CLT agora! // Se o fim da ESCALA 6x1 for aprovado a BOLSA acaba? É o fim? // PEC do fim da escala 6x1 é uma farsa // FIM DA ESCALA 6X1 ! // NANDO MOURA CONTRA A ESCALA 6X1 // Escala 6x1: eu sou contra! // ESCALA 6X1 NÃO É VIDA! PRECISAMOS FALAR SOBRE ISSO // Escala 6x1: A Escravidão dos Tempos Modernos! // POR QUE acabar com a JORNADA 6x1? Advogado comenta A PEC DO FIM DA ESCALA 6X1 // FIM DA ESCALA 6x1: por que esse tipo de trabalho tem que acabar? // tem como fazer a ESCALA 6X1 ser MENOS PIOR? // tentando SER FELIZ mesmo na ESCALA 6X1! #curiosidades #trabalho // 5 RISCOS da ESCALA 6x1 | DANDO O FURO // FIM DA ESCALA 6X1 // ESCALA 6X1: COMO É TRABALHAR NO SUPERMERCADO // A escala 6x1 vai continuar e não haverá mudanças // A verdade sobre CLT e a escala 6x1(as empresas não querem que você saiba disso) // 3 trabalhos para fugir da escala 6x1 #trabalho#work#escala#6x1 // A Escala 6x1 não é sua Verdadeira Inimiga // Fim da escala 6x1 e o Deputado Marco Feliciano // Marco Feliciano é contra o fim da escala 6x1 // VOCÊ É CONTRA A ESCALA 6x1? 🤔 #shorts #short #escala6x1 #escala6x1não #6x1 #clt  #trabalho #viral // Estou revoltado! com essa escala 6x1 (O início de tudo) // É o fim da escala 6x1? // Escala 6x1 tem que acabar, os piores argumentos. // Escala 6x1 voce concorda? #6x1 #escala5x2 #clt #trabalho // Fim da escala 6x1! Trabalhadores unidos! // Escala 6x1 ESCRAVIDÃO moderna! (Jovem fuja disso) // FIM DA ESCALA 6X1 #6x1 #escala6x1 #clt // Escala 6X1 #direito #escala6x1 #6x1 #bolsonaro #lula #direita #esquerda #trabalho #trabalhadores // FIM DA ESCALA 6x1 // 6X1 - A ESCALA DE TRABALHO DO INFERNO // Fim da escala 6x1 #escala6x1 // Fim da escala 6x1 // ","transcriptions.txt","95558","6154","639417","2024-11-12"
"Trabalhadora em escala 6x1 explica por que apoia PEC: &#39;Quero criar memórias com a minha filha&#39;","UOL","https://www.youtube.com/watch?v=o_Gwm51q69U","Principal","ANALISANDO AS POLÊMICAS (E MEMES) SOBRE A ESCALA 6X1 | Diva Depressão // Rick Azevedo critica PT por falta de adesão à PEC que pede o fim da escala 6x1: &#39;O que tá faltando?&#39; // Como o fim da escala 6x1 pode impactar o mercado de trabalho // Especialista em Direito do Trabalho explica consequências do fim da escala 6x1 // NEGARAM O FIM DA ESCALA 6X1!!? #clt #meme #memes #engraçado // Escala 6x1: uma nova era de avaliação no trabalho ou risco à Justiça Trabalhista? // FIM DA ESCALA 6x1: Any Ortiz explica sua posição sobre PEC | Timeline // Feliciano sobre Escala 6x1: &quot;Nos EUA, todos trabalham até a exaustão pra ver prosperidade e riqueza&quot; // tentando SER FELIZ mesmo na ESCALA 6X1! #curiosidades #trabalho // 5 RISCOS da ESCALA 6x1 | DANDO O FURO // Marco Feliciano é contra o fim da escala 6x1 // Fim da escala 6X1 // ","transcriptions.txt","800","425","15205","2024-11-12"
"MOVIMENTO VAT E O FIM DA ESCALA 6x1 | Gustavo Gaiofato","História Cabeluda","https://www.youtube.com/watch?v=Blc-zyl5Feg","Principal","Fala de Erika Hilton sobre escala 6x1 de Junho de 2024 viraliza após popularidade da PEC // Proibir a escala 6x1: estão te enganando! // ","transcriptions.txt","4195","391","36710","2024-05-01"
"Fim da Escala 6x1: Nikolas Ferreira detonado nas Redes Sociais","Thiago Okraszewski","https://www.youtube.com/watch?v=ygU_UIIAJKI","Principal","ESSA É A VERDADE SOBRE O FIM DA ESCALA 6X1 // PEC do fim da escala 6x1: Manifestações de apoio devem acontecer em 6 capitais | O POVO NEWS // PEC do fim da escala 6x1 é uma farsa // A escala 6x1 vai continuar e não haverá mudanças // VOCÊ É CONTRA A ESCALA 6x1? 🤔 #shorts #short #escala6x1 #escala6x1não #6x1 #clt  #trabalho #viral // Nikolas Ferreira é contra o fim da escala 6x1 🤦🏻‍♂️ #nikolasferreira #pec #shorts #politica #brasil // ","transcriptions.txt","677","358","9017","2024-11-10"
