"title","channel","url","type","linked_to","transcription","likes","comments","views","published_at"
"CEROL DAR SUA OPINIÃO SOBRE A ESCALA 6X1","REACTS DO CEROL","https://www.youtube.com/watch?v=iG8ZrTdgHCY","Principal","5 Provas que a Escala 6x1 é melhor que a 4x3 // Se o fim da escala 6x1 for aprovado a bolsa acaba? É o fim? // Escala 6x1: senador Cleitinho diz que é desumana: &#39;Isso não é questão de ideologia&#39; // REFUTANDO QUEM É CONTRA O FIM DA ESCALA 6X1 | FÁCIL DEMAIS // Fim da escala 6x1: você é a favor ou contra? 👷🏽⏰ #trabalho #profissão #dinheiro #negócios #shorts // URGENTE: FIM DA ESCALA 6X1 EXPLICADO ENTENDA DE UMA VEZ POR TODAS // Igão DISCUTE sobre FIM DA ESCALA 6X1 com PSIQUIATRA // A QUEDA DA ESCALA 6x1: LEO PICON vs ERIKA HILTON? (Precisamos falar sobre o Brasil) // URGENTE: A Escala 6x1 vai acabar? // Especialista em Direito do Trabalho explica consequências do fim da escala 6x1 // NEGARAM O FIM DA ESCALA 6X1!!? #clt #meme #memes #engraçado // FIM DA ESCALA 6X1: Katia começa a trabalhar no Supermercado e já se mete em confusão: CLT // FUI NAS RUAS PELO FIM DA ESCALA 6X1 // A ESCALA 6X1 VAI ACABAR? // Escala 6x1 e os impactos na vida do trabalhador brasileiro | Papo Rápido | GNT // Fim da escala 6x1 | Parte 1 // NÃO TEM POBREZA QUE RESISTA A 14 HORAS DE TRABALHO (Escala 6X1) // DEUS É CONTRA A ESCALA 6x1? OS 10 MANDAMENTOS PROÍBEM? // ESPOSA DE DEYVERSON OPINA SOBRE ESCALA 6X1: ‘SERÁ QUE A CULPA É DO SEU CHEFE?’ // A PEC do fim da ESCALA 6X1 vai ARRUINAR sua vida // ESCALA 6X1 Saiba o que já está em vigor! // FIM DA ESCALA 6X1: ENTENDA A DISCUSSÃO! // PEC do fim da escala 6x1: Manifestações de apoio devem acontecer em 6 capitais | O POVO NEWS // ESCALA 6X1: Impactos no CORPO e na MENTE | ANA BEATRIZ // JAMAIS TRABALHE NA ESCALA 6x1 // Feliciano sobre Escala 6x1: &quot;Nos EUA, todos trabalham até a exaustão pra ver prosperidade e riqueza&quot; // Fim da escala 6x1 | Entenda agora // Humanizei a Escala 6x1 #shorts // CLEITINHO E JORGE SEIF DISCUTEM SOBRE ESCALA 6X1 NO SENADO // DEPUTADOS QUE TRABALHAM 3X POR SEMANA ESTÃO CONTRA O FIM DA ESCALA 6x1 // Se o fim da ESCALA 6x1 for aprovado a BOLSA acaba? É o fim? // PEC do fim da escala 6x1 é uma farsa // SEU OSMAR E A ESCALA 6X1 DO ROBERTO ELE TA CANSADO DE TRABALHAR TENTE NÃO RIR 🤣 #humor #memes 🤠 // O DESABAFO DE UM TRABALHADOR ESCALA 6X1 // A ESCALA 6X1 TEM QUE ACABAR? // ESCALA 6x1: Será o fim desse modelo de trabalho? // NANDO MOURA CONTRA A ESCALA 6X1 // Escala 6x1: eu sou contra! // ESCALA 6X1 NÃO É VIDA! PRECISAMOS FALAR SOBRE ISSO // Escala 6x1: A Escravidão dos Tempos Modernos! // ESCALA 6X1: A VERDADE QUE NINGÉM TE CONTA // PEC do Fim da Escala 6x1: O Que Muda para os Trabalhadores? // O fim da escala 6x1 é uma oportunidade política única (e o governo tá vacilando) // FIM DA ESCALA 6x1: por que esse tipo de trabalho tem que acabar? // Afinal, o que é a Escala 6x1 ? #noticias #direitotrabalho #escala6x1 #6x1 #pec  #direitotrabalhador // ESCALA 6X1 NO CHIPANZIL NUNCA VAI ACABAR!! // FIM DA ESCALA 6x1 #hamletpng #shorts // tem como fazer a ESCALA 6X1 ser MENOS PIOR? // tentando SER FELIZ mesmo na ESCALA 6X1! #curiosidades #trabalho // FIM DA ESCALA 6X1: ENTENDA A PROPOSTA ABSURDA QUE PODE DESTRUIR O BRASIL! // 5 RISCOS da ESCALA 6x1 | DANDO O FURO // SACANI MANDA A REAL SOBRE PEC CONTRA ESCALA 6X1 // Essa escala 6x1 eu não aguento mais #shorts #drama // FIM DA ESCALA 6X1 // ESCALA 6X1: COMO É TRABALHAR NO SUPERMERCADO // Noubari - escala 6x1 // A escala 6x1 vai continuar e não haverá mudanças // A verdade sobre CLT e a escala 6x1(as empresas não querem que você saiba disso) // ESCALA 6x1 #shorts // 3 trabalhos para fugir da escala 6x1 #trabalho#work#escala#6x1 // RENAN FALANDO SOBRE A ESCALA 6X1 KKKKKKKKKKKKKKKKKKKKKKKKKKKKKKKKKKKKKKKKKKKKKK // Escala 6x1: Por Que Não Tenho Escolha // A Escala 6x1 não é sua Verdadeira Inimiga // A escala 6x1 tem que acabar no BOSTIL! // Marco Feliciano é contra o fim da escala 6x1 // VOCÊ É CONTRA A ESCALA 6x1? 🤔 #shorts #short #escala6x1 #escala6x1não #6x1 #clt  #trabalho #viral // Estou revoltado! com essa escala 6x1 (O início de tudo) // É o fim da escala 6x1? // Escala 6x1 #shorts  #camaçari #6x1 #Escala6x1 // Escala 6x1 tem que acabar, os piores argumentos. // Fim da escala 6X1 // Escala 6x1 voce concorda? #6x1 #escala5x2 #clt #trabalho // Fim da escala 6x1! Trabalhadores unidos! // FIM DA ESCALA 6X1 #6x1 #escala6x1 #clt // Escala 6x1 - Parte 1  #humor #cenas #comedia #6x1 #escala6x1 // Escala 6x1 - parte 2 #humor #cenas #comedia #6x1 #escala6x1 // A escala 6x1 é desumana! - Pt 2 @paulovcoach #paulovieiracortes #clt #6x1 #escala6x1 #trabalho // Escala 6X1 #direito #escala6x1 #6x1 #bolsonaro #lula #direita #esquerda #trabalho #trabalhadores // FIM DA ESCALA 6x1 // 6X1 - A ESCALA DE TRABALHO DO INFERNO // Escala 6x1 part2 // A ESCALA 6x1 ESTÁ ACABANDO COM VOCÊ? // A escala 6x1 é o pior erro do bostil // Desabafo de um jovem trabalhador na escala 6x1 // Escala 6x1 // Fim da escala 6x1 #escala6x1 // Escala 6X1 😰#6x1 // Escala 6x1.   #6x1 #clt // #noticias #escala #6x1 #pec #constituicaofederal #fim // Cerol fala sobre a Escala 6x1 Deve ou não deve acabar ? #cerol #escala #6x1 #clt // Fim da escala 6x1 // ESCALA 6x1: PAVANATO vs FEMINISTA #feminista #entertainment #escala #pavanato #6x1 // ","transcriptions.txt","80","10","671","2024-11-12"
"FIM DA ESCALA 6X1","Alê Since 1994","https://www.youtube.com/watch?v=h3lJ24Ivlyk","Principal","5 Provas que a Escala 6x1 é melhor que a 4x3 // ANALISANDO AS POLÊMICAS (E MEMES) SOBRE A ESCALA 6X1 | Diva Depressão // ninguém aguenta mais a ESCALA 6x1 // Se o fim da escala 6x1 for aprovado a bolsa acaba? É o fim? // O Fim da Escala 6x1 vai Quebrar a Economia do Brasil // REFUTANDO QUEM É CONTRA O FIM DA ESCALA 6X1 | FÁCIL DEMAIS // Gil do Vigor detona quem é contra fim da escala 6x1: &#39;Trabalhador mais descansado é mais produtivo&#39; // Igão DISCUTE sobre FIM DA ESCALA 6X1 com PSIQUIATRA // FIM DA ESCALA 6X1 (COM ESTUDOS) • Física e Afins // A QUEDA DA ESCALA 6x1: LEO PICON vs ERIKA HILTON? (Precisamos falar sobre o Brasil) // URGENTE: A Escala 6x1 vai acabar? // Especialista em Direito do Trabalho explica consequências do fim da escala 6x1 // FIM DA ESCALA 6X1: Katia começa a trabalhar no Supermercado e já se mete em confusão: CLT // A ESCALA 6X1 VAI ACABAR? // ESCALA 6x1: A ROTINA QUE DESTRÓI MILHÕES de BRASILEIROS (Vídeo Irrefutável) // Fim da escala 6x1 | Parte 1 // FIM DA ESCALA 6X1: ENTENDA A DISCUSSÃO! // PEC do fim da escala 6x1: Manifestações de apoio devem acontecer em 6 capitais | O POVO NEWS // JAMAIS TRABALHE NA ESCALA 6x1 // Feliciano sobre Escala 6x1: &quot;Nos EUA, todos trabalham até a exaustão pra ver prosperidade e riqueza&quot; // Fim da escala 6x1 | Entenda agora // O fim da Escala 6x1: Como essa mudança afeta Pequenos Empresários e Trabalhadores // Humanizei a Escala 6x1 #shorts // DEPUTADOS QUE TRABALHAM 3X POR SEMANA ESTÃO CONTRA O FIM DA ESCALA 6x1 // COMO O FIM DA ESCALA 6X1 PODE IMPACTAR EMPRESAS E TRABALHADORES? #FN // ESCALA 6X1 e fim do concurso de CARREIRA! Concurso CLT agora! // Se o fim da ESCALA 6x1 for aprovado a BOLSA acaba? É o fim? // Escala 6x1 - O Jovem quer SABER!!! // PEC do fim da escala 6x1 é uma farsa // FIM DA ESCALA 6x1 PODE DESTRUIR A ECONOMIA BRASILEIRA // ESCALA 6x1: Será o fim desse modelo de trabalho? // Escala 6x1: eu sou contra! // Escala 6x1: A Escravidão dos Tempos Modernos! // O fim da escala 6x1 é uma oportunidade política única (e o governo tá vacilando) // O QUE NÃO TE CONTAM SOBRE O FIM DA ESCALA 6X1? // FIM DA ESCALA 6x1: por que esse tipo de trabalho tem que acabar? // Afinal, o que é a Escala 6x1 ? #noticias #direitotrabalho #escala6x1 #6x1 #pec  #direitotrabalhador // Escala 6x1 em Debate: Famosos como Leo Picon, Jade, Luana Piovani e Gil do Vigor opinam sobre a PEC // tem como fazer a ESCALA 6X1 ser MENOS PIOR? // Como SAIR da ESCALA 6X1 para sempre // 5 RISCOS da ESCALA 6x1 | DANDO O FURO // O FIM DA ESCALA 6X1 É UMA UTOPIA NO BRASIL! // CEROL DAR SUA OPINIÃO SOBRE A ESCALA 6X1 // ESCALA 6X1: NÃO É O ÚNICO PROBLEMA | CORTES // 3 trabalhos para fugir da escala 6x1 #trabalho#work#escala#6x1 // A Escala 6x1 não é sua Verdadeira Inimiga // Fim da escala 6x1 e o Deputado Marco Feliciano // Faz tempo que eu não trabalho na escala 6x1, mas lembro como era ruim. Não desejo pra ninguém! #6x1 // VOCÊ É CONTRA A ESCALA 6x1? 🤔 #shorts #short #escala6x1 #escala6x1não #6x1 #clt  #trabalho #viral // Estou revoltado! com essa escala 6x1 (O início de tudo) // TRABALHAR NA ESCALA 6X1 VAI ARRUINAR SUA VIDA? (1 DE 2) - REACT @mbcnate // É o fim da escala 6x1? // Fim da escala 6X1 // Escala 6x1 voce concorda? #6x1 #escala5x2 #clt #trabalho // Fim da escala 6x1! Trabalhadores unidos! // Escala 6x1 ESCRAVIDÃO moderna! (Jovem fuja disso) // FIM DA ESCALA 6X1 #6x1 #escala6x1 #clt // ESCALA 6X1 É A ESCRAVIDÃO MODERNA DO SECULO XXI ?? [REACT] // FIM da ESCALA 6x1. A VERDADE REVEL4DA! // FIM DA ESCALA 6x1 // O que não te contaram sobre o FIM DA ESCALA 6x1 // Escala 6x1 // Fim da escala 6x1 #escala6x1 // Escala 6X1 😰#6x1 // Fim da escala 6x1 // ESCALA 6x1: PAVANATO vs FEMINISTA #feminista #entertainment #escala #pavanato #6x1 // ","transcriptions.txt","17","7","150","2024-08-10"
"ARTHUR DO VAL DETONA PEC DA ESCALA 6x1| E Detalhe | Arthur do Val","MBLiveTV - Lives do MBL","https://www.youtube.com/watch?v=poTAp5jTUtA","Principal","VENDI MEU PC E AGORA VOU VIRAR CLT NA ESCALA 6X1 #fyb #bancos #clt #6x1 // ","transcriptions.txt","5272","225","33327","2024-11-12"
"VOCÊ APOIA A ESCALA 6x1? #chefe #humor #esposa","GuiPansiga","https://www.youtube.com/watch?v=bp7y9mgSyfI","Principal","Fim da escala 6x1 | Parte 1 // ESPOSA DE DEYVERSON OPINA SOBRE ESCALA 6X1: ‘SERÁ QUE A CULPA É DO SEU CHEFE?’ // Essa escala 6x1 eu não aguento mais #shorts #drama // ESCALA 6x1 #shorts // ","transcriptions.txt","4636","12","49349","2024-11-15"
"ESCALA 6X1: NÃO É O ÚNICO PROBLEMA | CORTES","Cortes do Chocolate","https://www.youtube.com/watch?v=o_KyHpXyIYs","Principal","Quer ARRUINAR a sua vida? Trabalhe na ESCALA 6X1 // MEMES pra te AJUDAREM na ESCALA 6x1 - Cinema dos MEMES // Escala 6x1: A Escravidão dos Tempos Modernos! // ESCALA 6X1: A VERDADE QUE NINGÉM TE CONTA // Essa escala 6x1 eu não aguento mais #shorts #drama // FIM DA ESCALA 6X1 // Noubari - escala 6x1 // A verdade sobre CLT e a escala 6x1(as empresas não querem que você saiba disso) // ESCALA 6x1 #shorts // A Escala 6x1 não é sua Verdadeira Inimiga // Estou revoltado! com essa escala 6x1 (O início de tudo) // EU SAI DA ESCALA 6X1 (TROQUEI DE EMPREGO) // ESCALA 6X1 É A ESCRAVIDÃO MODERNA DO SECULO XXI ?? [REACT] // FIM DA ESCALA 6x1 // ","transcriptions.txt","666","68","5837","2024-09-30"
"DESABAFO DA ESCALA 6X1","HERMINIO SABALLA","https://www.youtube.com/watch?v=YwEC_9hyzIw","Principal","Escala 6x1. Exploração ou vadiagem? // O Fim da Escala 6 X 1 // Se o fim da escala 6x1 for aprovado a bolsa acaba? É o fim? // O Fim da Escala 6x1 vai Quebrar a Economia do Brasil // a TRUE por trás da escala 6x1 // ESCALA 6X1: FIQUE RICO OU MORRA TENTANDO - DIRETO DO FIM DO MUNDO EP 08 // Fim da escala 6x1 vai &quot;quebrar a economia&quot; ? // Fim da Escala 6x1 e 44h Vai Destruir Algumas Empresas, Odeio 6x1, mas entenda que.... // A escala 6x1 vai acabar? Por que o assunto ganhou os holofotes // URGENTE: FIM DA ESCALA 6X1 EXPLICADO ENTENDA DE UMA VEZ POR TODAS // O FIM DA ESCALA 6X1 EXPLICADO // Redução da jornada de trabalho: PEC que acaba com a escala 6X1 está em debate // Escala 6x1: Redução de jornada é tendência, mas, por meio de lei, eleva informalidade, diz Landim // TRABALHADOR EXAUSTO FAZ DESABAFO SOBRE ESCALA 6X1 // Desabafo REAL Sobre a Escala 6x1: Vale a Pena? // ESCALA 6x1: A ROTINA QUE DESTRÓI MILHÕES de BRASILEIROS (Vídeo Irrefutável) // Fim da escala 6x1 | Parte 1 // Por que a proposta do fim da escala 6x1 é a 4x3? // A ESCALA 6x1 VAI ACABAR? | PAUTA QUENTE // 🟡🔵 TRABALHO ESCALA 6x1. FEZ UM ESTRAGO NA MINHA VIDA // ESCALA 6X1 Saiba o que já está em vigor! // FIM DA ESCALA 6X1: ENTENDA A DISCUSSÃO! // FIM DA ESCALA 6X1 NOS CONCURSOS PÚBLICOS. O que muda na prática? // Quer ARRUINAR a sua vida? Trabalhe na ESCALA 6X1 // VALE A PENA DESTRUIR SUA VIDA EM UM SUBEMPREGO? | ESCALA 6X1 // PAULO KOGOS TENTA EXPLICAR PORQUE É A FAVOR DA ESCALA 6X1 | Galãs Feios // Se o fim da ESCALA 6x1 for aprovado a BOLSA acaba? É o fim? // ADEUS ESCALA 6X1, ADEUS SUPERMERCADO : PEDI DEMISSÃO !! // FIM DA ESCALA 6x1 PODE DESTRUIR A ECONOMIA BRASILEIRA // NANDO MOURA CONTRA A ESCALA 6X1 // SENADOR DE EXTREMA DIREITA É CONTRA ESCALA 6X1 E A FAVOR DOS TRABALHADORES | Galãs Feios // Escala 6x1: A Escravidão dos Tempos Modernos! // ESCALA 6X1: A VERDADE QUE NINGÉM TE CONTA // ZEUS REAGE: O PROBLEMA SÃO VOCÊS E NÃO A ESCALA 6X1! // FIM DA ESCALA 6X1 COM REDUÇÃO DE JORNADA DE TRABALHO - APROVAÇÃO PELOS DEPUTADOS FIM DA ESCALA 6X1 // Escala 6x1 - o que não te contaram // A ESCALA 6x1 TEM QUE ACABAR - MURILO REAGE (Cortes da Live do Suco de Brasil) // NATHAN M.B.C. MANDA A REAL SOBRE A ESCALA DE TRABALHO 6X1 (VAT: MOVIMENTO VIDA ALÉM DO TRABALHO) // Fiz uma comparação da escala 6X1 do trabalhador com a do político. // ESCALA 6X1 NO CHIPANZIL NUNCA VAI ACABAR!! // FIM DA ESCALA 6x1 #hamletpng #shorts // tem como fazer a ESCALA 6X1 ser MENOS PIOR? // A maioria do povo brasileiro quer o fim da escala 6x1 // Como SAIR da ESCALA 6X1 para sempre // FIM DA ESCALA 6X1: VALE A PENA PARA O EMPRESÁRIO? | CORTES // Lado B do Rio #328 – Contra a escala 6x1, com Rick Azevedo (PSOL-RJ) // Essa escala 6x1 eu não aguento mais #shorts #drama // ESCALA 6X1: COMO É TRABALHAR NO SUPERMERCADO // Noubari - escala 6x1 // CLT e a ESCALA 6X1 - Fuja Disso! // A escala 6x1 vai continuar e não haverá mudanças // 2 passos para TANKAR e SAIR da ESCALA 6x1 // ESCALA 6x1 #shorts // FIM DA ESCALA 6X1 // Escala 6x1 em discussão na Câmara: Como a esquerda vai desempregar ainda mais brasileiros. // Como sair da escala 6x1 e começar no Youtube (sem passar fome) // VOCÊ É CONTRA A ESCALA 6x1? 🤔 #shorts #short #escala6x1 #escala6x1não #6x1 #clt  #trabalho #viral // TRABALHAR NA ESCALA 6X1 VAI ARRUINAR SUA VIDA? (1 DE 2) - REACT @mbcnate // Escala 6x1 tem que acabar, os piores argumentos. // DESABAFO ESCALA 6X1: A REALIDADE DOS TRABALHADORES BRASILEIROS! | REACT. Luideverso // Escala 6x1 voce concorda? #6x1 #escala5x2 #clt #trabalho // EU SAI DA ESCALA 6X1 (TROQUEI DE EMPREGO) // ESCALA 6X1 É A ESCRAVIDÃO MODERNA DO SECULO XXI ?? [REACT] // MAMAEFALEI FOI REFUTADO CONTRA A ESCALA 6X1 | Cortes do @MBLiveTV // ESCALA 6X1 | SÓ IDIOTAS E IMBECIS RECLAMAM DISSO // A escala 6x1 é o pior erro do bostil // SUPER XANDÃO REAGINDO A Escala 6x1  O Jovem quer SABER!!! // ","transcriptions.txt","360","70","3531","2024-09-09"
"pelo fim da escala 6x1: chega!","Matheus e Guigo Show","https://www.youtube.com/watch?v=DjU5KamacFc","Principal","URGENTE: A Escala 6x1 vai acabar? // Especialista em Direito do Trabalho explica consequências do fim da escala 6x1 // FIM DA ESCALA 6X1: ENTENDA A DISCUSSÃO! // FIM DA ESCALA 6X1 DEIXA EXTREMA DIRETA DESORIENTADA // PÂNICO ANALISA NOVOS DETALHES SOBRE A POLÊMICA ESCALA 6X1 E DEBATE AO VIVO! // Fim da escala 6x1 ganha pressão nas redes sociais e deve ser discutida no Congresso | Central Meio // PAULO KOGOS TENTA EXPLICAR PORQUE É A FAVOR DA ESCALA 6X1 | Galãs Feios // ESCALA 6X1: A VERDADE QUE NINGÉM TE CONTA // ESCALA 6X1: COMO É TRABALHAR NO SUPERMERCADO // MAMÃE FALEI DEBATE CONTRA ESCALA 6X1 | CORTES // Estou revoltado! com essa escala 6x1 (O início de tudo) // Escala 6x1 tem que acabar, os piores argumentos. // EU SAI DA ESCALA 6X1 (TROQUEI DE EMPREGO) // ","transcriptions.txt","32162","2587","230415","2024-11-14"
"JOVEM PAN ACOLHE LÉO PICON APÓS MASSACRE SOBRE ESCALA 6x1: &quot;A GENTE TEM QUE ENTENDER O EMPRESÁRIO&quot;","TV Afiada","https://www.youtube.com/watch?v=gtFXZC4bahk","Principal","PROJETO DE FIM DA ESCALA 6X1 É IMPULSIONADO PELAS REDES SOCIAIS E PRESSIONA CONGRESSO NACIONAL // Léo Picon REAGE após &#39;massacre&#39; por fala sobre ESCALA 6x1 e diz que não é contra os trabalhadores // O fim da escala 6x1 é uma oportunidade política única (e o governo tá vacilando) // TREZOITAO É A FAVOR DA ESCALA 6X1? // Nikolas Ferreira é contra o fim da escala 6x1 🤦🏻‍♂️ #nikolasferreira #pec #shorts #politica #brasil // ","transcriptions.txt","1345","234","11601","2024-11-12"
"BOLSONARO NA MIRA / ONDA CONSERVADORA NO MUNDO / FIM DA ESCALA 6X1? - OS PINGOS NOS IS 11/11/2024","Jovem Pan News","https://www.youtube.com/watch?v=tsgCXO6FPyY","Principal","Fim da escala 6x1? Deputados federais discutem PEC contra jornada | Conversas Cruzadas | 12/11/2024 // FIM DA ESCALA 6X1: os prós, os contras e tramitação no Congresso | Gaúcha Atualidade | 13/11/2024 // ","transcriptions.txt","1541","35","64173","2024-11-11"
"ESCALA 6X1: COMO É TRABALHAR NO SUPERMERCADO","VICTOR","https://www.youtube.com/watch?v=Nh_0sRu2qxo","Principal","ANALISANDO AS POLÊMICAS (E MEMES) SOBRE A ESCALA 6X1 | Diva Depressão // O Fim da Escala 6 X 1 // Se o fim da escala 6x1 for aprovado a bolsa acaba? É o fim? // O Fim da Escala 6x1 vai Quebrar a Economia do Brasil // Escala 6x1: senador Cleitinho diz que é desumana: &#39;Isso não é questão de ideologia&#39; // DEBATE QUENTE sobre a ESCALA 6X1 - ARTHUR DO VAL X ALFREDINHO // a TRUE por trás da escala 6x1 // ESCALA 6X1: FIQUE RICO OU MORRA TENTANDO - DIRETO DO FIM DO MUNDO EP 08 // Fim da escala de 6x1: PEC tem mais de 130 assinaturas | CNN NOVO DIA // REFUTANDO QUEM É CONTRA O FIM DA ESCALA 6X1 | FÁCIL DEMAIS // Fim da escala 6x1: você é a favor ou contra? 👷🏽⏰ #trabalho #profissão #dinheiro #negócios #shorts // Fim da Escala 6x1 e 44h Vai Destruir Algumas Empresas, Odeio 6x1, mas entenda que.... // Rick Azevedo critica PT por falta de adesão à PEC que pede o fim da escala 6x1: &#39;O que tá faltando?&#39; // A escala 6x1 vai acabar? Por que o assunto ganhou os holofotes // URGENTE: FIM DA ESCALA 6X1 EXPLICADO ENTENDA DE UMA VEZ POR TODAS // URGENTE: A Escala 6x1 vai acabar? // O FIM DA ESCALA 6X1 EXPLICADO // Especialista em Direito do Trabalho explica consequências do fim da escala 6x1 // Redução da jornada de trabalho: PEC que acaba com a escala 6X1 está em debate // ESSA É A VERDADE SOBRE O FIM DA ESCALA 6X1 // Escala 6x1: Redução de jornada é tendência, mas, por meio de lei, eleva informalidade, diz Landim // FIM DA ESCALA 6X1: Katia começa a trabalhar no Supermercado e já se mete em confusão: CLT // TRABALHADOR EXAUSTO FAZ DESABAFO SOBRE ESCALA 6X1 // A ESCALA 6X1 VAI ACABAR? // Desabafo REAL Sobre a Escala 6x1: Vale a Pena? // Fim da escala 6x1 | Parte 1 // Por que a proposta do fim da escala 6x1 é a 4x3? // DEUS É CONTRA A ESCALA 6x1? OS 10 MANDAMENTOS PROÍBEM? // A ESCALA 6x1 VAI ACABAR? | PAUTA QUENTE // Escala 6x1: Deputado do PL critica modelo e diz que debate &quot;não é questão de ideologia&quot; // FIM DA ESCALA 6x1: Any Ortiz explica sua posição sobre PEC | Timeline // A PEC do fim da ESCALA 6X1 vai ARRUINAR sua vida // ESCALA 6X1 Saiba o que já está em vigor! // FIM DA ESCALA 6X1: ENTENDA A DISCUSSÃO! // PEC do fim da escala 6x1: Manifestações de apoio devem acontecer em 6 capitais | O POVO NEWS // ESCALA 6X1: Impactos no CORPO e na MENTE | ANA BEATRIZ // Fim da escala 6x1 | Entenda agora // FIM DA ESCALA 6X1 DEIXA EXTREMA DIRETA DESORIENTADA // Humanizei a Escala 6x1 #shorts // Quer ARRUINAR a sua vida? Trabalhe na ESCALA 6X1 // CLEITINHO E JORGE SEIF DISCUTEM SOBRE ESCALA 6X1 NO SENADO // PÂNICO ANALISA NOVOS DETALHES SOBRE A POLÊMICA ESCALA 6X1 E DEBATE AO VIVO! // ESCALA 6X1 e fim do concurso de CARREIRA! Concurso CLT agora! // PAULO KOGOS TENTA EXPLICAR PORQUE É A FAVOR DA ESCALA 6X1 | Galãs Feios // Se o fim da ESCALA 6x1 for aprovado a BOLSA acaba? É o fim? // ADEUS ESCALA 6X1, ADEUS SUPERMERCADO : PEDI DEMISSÃO !! // Escala 6x1 - O Jovem quer SABER!!! // SEU OSMAR E A ESCALA 6X1 DO ROBERTO ELE TA CANSADO DE TRABALHAR TENTE NÃO RIR 🤣 #humor #memes 🤠 // NANDO MOURA CONTRA A ESCALA 6X1 // SENADOR DE EXTREMA DIREITA É CONTRA ESCALA 6X1 E A FAVOR DOS TRABALHADORES | Galãs Feios // Escala 6x1: eu sou contra! // ESCALA 6X1 NÃO É VIDA! PRECISAMOS FALAR SOBRE ISSO // Escala 6x1: A Escravidão dos Tempos Modernos! // ESCALA 6X1: A VERDADE QUE NINGÉM TE CONTA // Escala 6x1 - o que não te contaram // O fim da escala 6x1 é uma oportunidade política única (e o governo tá vacilando) // A ESCALA 6x1 TEM QUE ACABAR - MURILO REAGE (Cortes da Live do Suco de Brasil) // NATHAN M.B.C. MANDA A REAL SOBRE A ESCALA DE TRABALHO 6X1 (VAT: MOVIMENTO VIDA ALÉM DO TRABALHO) // FIM DA ESCALA 6x1: por que esse tipo de trabalho tem que acabar? // Fiz uma comparação da escala 6X1 do trabalhador com a do político. // ESCALA 6X1 NO CHIPANZIL NUNCA VAI ACABAR!! // FIM DA ESCALA 6x1 #hamletpng #shorts // tem como fazer a ESCALA 6X1 ser MENOS PIOR? // A maioria do povo brasileiro quer o fim da escala 6x1 // Como SAIR da ESCALA 6X1 para sempre // FIM DA ESCALA 6X1: ENTENDA A PROPOSTA ABSURDA QUE PODE DESTRUIR O BRASIL! // 5 RISCOS da ESCALA 6x1 | DANDO O FURO // Essa escala 6x1 eu não aguento mais #shorts #drama // CEROL DAR SUA OPINIÃO SOBRE A ESCALA 6X1 // DESABAFO DA ESCALA 6X1 // pelo fim da escala 6x1: chega! // Noubari - escala 6x1 // CLT e a ESCALA 6X1 - Fuja Disso! // Fim da escala 6x1 // ZEUS REAGE: A ESCALA 6X1 VAI ACABAR COM A BOLSA // A escala 6x1 vai continuar e não haverá mudanças // A verdade sobre CLT e a escala 6x1(as empresas não querem que você saiba disso) // 2 passos para TANKAR e SAIR da ESCALA 6x1 // ESCALA 6x1 #shorts // RENAN FALANDO SOBRE A ESCALA 6X1 KKKKKKKKKKKKKKKKKKKKKKKKKKKKKKKKKKKKKKKKKKKKKK // MAMÃE FALEI DEBATE CONTRA ESCALA 6X1 | CORTES // FIM DA ESCALA 6X1 // A Escala 6x1 não é sua Verdadeira Inimiga // Como sair da escala 6x1 e começar no Youtube (sem passar fome) // VOCÊ É CONTRA A ESCALA 6x1? 🤔 #shorts #short #escala6x1 #escala6x1não #6x1 #clt  #trabalho #viral // Estou revoltado! com essa escala 6x1 (O início de tudo) // TRABALHAR NA ESCALA 6X1 VAI ARRUINAR SUA VIDA? (1 DE 2) - REACT @mbcnate // Escala 6x1 tem que acabar, os piores argumentos. // DESABAFO ESCALA 6X1: A REALIDADE DOS TRABALHADORES BRASILEIROS! | REACT. Luideverso // Fim da escala 6X1 // Escala 6x1 voce concorda? #6x1 #escala5x2 #clt #trabalho // Escala 6x1 ESCRAVIDÃO moderna! (Jovem fuja disso) // FIM DA ESCALA 6X1 #6x1 #escala6x1 #clt // EU SAI DA ESCALA 6X1 (TROQUEI DE EMPREGO) // Escala 6x1 - Parte 1  #humor #cenas #comedia #6x1 #escala6x1 // O QUE RENAN ACHA DA ESCALA 6X1 ?? // ESCALA 6X1 É A ESCRAVIDÃO MODERNA DO SECULO XXI ?? [REACT] // Escala 6X1 #direito #escala6x1 #6x1 #bolsonaro #lula #direita #esquerda #trabalho #trabalhadores // FIM DA ESCALA 6x1 // ESCALA 6X1 | SÓ IDIOTAS E IMBECIS RECLAMAM DISSO // Escala 6x1 part2 // A escala 6x1 é o pior erro do bostil // Escala 6x1 // SUPER XANDÃO REAGINDO A Escala 6x1  O Jovem quer SABER!!! // Escala 6x1.   #6x1 #clt // Cerol fala sobre a Escala 6x1 Deve ou não deve acabar ? #cerol #escala #6x1 #clt // ","transcriptions.txt","12637","1653","130973","2024-07-15"
