"title","channel","url","type","linked_to","transcription","likes","comments","views","published_at"
"TRABALHADOR EXAUSTO FAZ DESABAFO SOBRE ESCALA 6X1","luideverso","https://www.youtube.com/watch?v=otoz_BPMAg4","Principal","Escala 6x1. Exploração ou vadiagem? // O Fim da Escala 6 X 1 // Se o fim da escala 6x1 for aprovado a bolsa acaba? É o fim? // a TRUE por trás da escala 6x1 // FIM DA ESCALA DE TRABALHO 6x1: o que está sendo proposto? Como começou o movimento? ESTADÃO EXPLICA // Como o fim da escala 6x1 pode impactar o mercado de trabalho // A escala 6x1 vai acabar? Por que o assunto ganhou os holofotes // URGENTE: A Escala 6x1 vai acabar? // O FIM DA ESCALA 6X1 EXPLICADO // Especialista em Direito do Trabalho explica consequências do fim da escala 6x1 // Redução da jornada de trabalho: PEC que acaba com a escala 6X1 está em debate // Escala 6x1: uma nova era de avaliação no trabalho ou risco à Justiça Trabalhista? // Desabafo REAL Sobre a Escala 6x1: Vale a Pena? // ESCALA 6x1: A ROTINA QUE DESTRÓI MILHÕES de BRASILEIROS (Vídeo Irrefutável) // O FIM DA JORNADA 6x1... TUDO O QUE VOCÊ PRECISA SABER! // A ESCALA 6x1 VAI ACABAR? | PAUTA QUENTE // ESCALA 6X1 Saiba o que já está em vigor! // FIM DA ESCALA 6X1: ENTENDA A DISCUSSÃO! // PEC do fim da escala 6x1: Manifestações de apoio devem acontecer em 6 capitais | O POVO NEWS // O que é a PEC da escala 6x1 // Feliciano sobre Escala 6x1: &quot;Nos EUA, todos trabalham até a exaustão pra ver prosperidade e riqueza&quot; // FIM DA ESCALA 6X1 NOS CONCURSOS PÚBLICOS. O que muda na prática? // Fim da escala 6x1: Entenda como funciona o modelo atual e o que PEC pode mudar // PEC pelo fim da escala 6x1 atinge assinaturas e já pode tramitar no Congresso // Quer ARRUINAR a sua vida? Trabalhe na ESCALA 6X1 // ESCALA 6X1 e fim do concurso de CARREIRA! Concurso CLT agora! // PAULO KOGOS TENTA EXPLICAR PORQUE É A FAVOR DA ESCALA 6X1 | Galãs Feios // Se o fim da ESCALA 6x1 for aprovado a BOLSA acaba? É o fim? // ADEUS ESCALA 6X1, ADEUS SUPERMERCADO : PEDI DEMISSÃO !! // PEC do fim da escala 6x1 é uma farsa // FIM DA ESCALA 6x1 PODE DESTRUIR A ECONOMIA BRASILEIRA // O DESABAFO DE UM TRABALHADOR ESCALA 6X1 // Escala 6x1: Como surgiu o debate sobre o assunto? #trabalhadores #6x1 #direitostrabalhistas // Escala 6x1: eu sou contra! // Escala 6x1: A Escravidão dos Tempos Modernos! // ESCALA 6X1: A VERDADE QUE NINGÉM TE CONTA // A ESCALA 6x1 TEM QUE ACABAR - MURILO REAGE (Cortes da Live do Suco de Brasil) // FIM DA ESCALA 6x1: por que esse tipo de trabalho tem que acabar? // Escala 6x1 em Debate: Famosos como Leo Picon, Jade, Luana Piovani e Gil do Vigor opinam sobre a PEC // Fiz uma comparação da escala 6X1 do trabalhador com a do político. // tem como fazer a ESCALA 6X1 ser MENOS PIOR? // A maioria do povo brasileiro quer o fim da escala 6x1 // Como SAIR da ESCALA 6X1 para sempre // FIM DA ESCALA 6X1: VALE A PENA PARA O EMPRESÁRIO? | CORTES // FIM DA ESCALA 6X1: ENTENDA A PROPOSTA ABSURDA QUE PODE DESTRUIR O BRASIL! // Essa escala 6x1 eu não aguento mais #shorts #drama // DESABAFO DA ESCALA 6X1 // ESCALA 6X1: COMO É TRABALHAR NO SUPERMERCADO // ZEUS REAGE: A ESCALA 6X1 VAI ACABAR COM A BOLSA // A escala 6x1 vai continuar e não haverá mudanças // 2 passos para TANKAR e SAIR da ESCALA 6x1 // FIM DA ESCALA 6X1 // Escala 6x1 em discussão na Câmara: Como a esquerda vai desempregar ainda mais brasileiros. // Cleitinho confronta aliados e quer Fim da Escala 6x1- Nikolas Ferreira rebate críticas // Fim da escala 6x1 e o Deputado Marco Feliciano // Como sair da escala 6x1 e começar no Youtube (sem passar fome) // FIM DA ESCALA 6x1 // VOCÊ É CONTRA A ESCALA 6x1? 🤔 #shorts #short #escala6x1 #escala6x1não #6x1 #clt  #trabalho #viral // Escala 6x1 tem que acabar, os piores argumentos. // DESABAFO ESCALA 6X1: A REALIDADE DOS TRABALHADORES BRASILEIROS! | REACT. Luideverso // Escala 6x1 voce concorda? #6x1 #escala5x2 #clt #trabalho // Escala 6x1 ESCRAVIDÃO moderna! (Jovem fuja disso) // EU SAI DA ESCALA 6X1 (TROQUEI DE EMPREGO) // ESCALA 6X1 É A ESCRAVIDÃO MODERNA DO SECULO XXI ?? [REACT] // MAMAEFALEI FOI REFUTADO CONTRA A ESCALA 6X1 | Cortes do @MBLiveTV // ESCALA 6X1 | SÓ IDIOTAS E IMBECIS RECLAMAM DISSO // Escala 6x1 part2 // A escala 6x1 é o pior erro do bostil // Desabafo de um jovem trabalhador na escala 6x1 // ","transcriptions.txt","10511","1873","122171","2024-10-15"
"A ESCALA 6X1 VAI ACABAR?","TUBARÃO DA BOLSA","https://www.youtube.com/watch?v=nGNObZDRqAk","Principal","FIM DA ESCALA 6X1 // 6x1: entenda o projeto que pede o fim da escala 6x1 | Leonardo Sakamoto // 5 Provas que a Escala 6x1 é melhor que a 4x3 // Fim da escala 6x1 é &#39;bastante prejudicial&#39; ao trabalhador, diz presidente do Banco Central // REFUTANDO QUEM É CONTRA O FIM DA ESCALA 6X1 | FÁCIL DEMAIS // URGENTE: FIM DA ESCALA 6X1 EXPLICADO ENTENDA DE UMA VEZ POR TODAS // Escala 6x1: Luana Piovani defende PEC e critica os &#39;ricos de direita&#39;: &#39;Por que não têm compaixão?&#39; // Especialista em Direito do Trabalho explica consequências do fim da escala 6x1 // ESSA É A VERDADE SOBRE O FIM DA ESCALA 6X1 // Escala 6x1: Redução de jornada é tendência, mas, por meio de lei, eleva informalidade, diz Landim // Fim da escala 6x1: PEC atinge assinaturas necessárias | Chega Mais Notícias (13/11/24) // Fim da escala 6x1 | Parte 1 // 🚨ALERTA: FIM DA ESCALA 6x1 COLOCARÁ EM XEQUE OS EMPREGOS NO BRASIL? // PEC do fim da escala 6x1: Manifestações de apoio devem acontecer em 6 capitais | O POVO NEWS // Feliciano sobre Escala 6x1: &quot;Nos EUA, todos trabalham até a exaustão pra ver prosperidade e riqueza&quot; // Humanizei a Escala 6x1 #shorts // CLEITINHO E JORGE SEIF DISCUTEM SOBRE ESCALA 6X1 NO SENADO // PÂNICO ANALISA NOVOS DETALHES SOBRE A POLÊMICA ESCALA 6X1 E DEBATE AO VIVO! // Leo Picon volta a se pronunciar após polêmica da escala 6x1 // Escala 6x1 - O Jovem quer SABER!!! // PEC do fim da escala 6x1 é uma farsa // FIM DA ESCALA 6X1 ! // Senador Cleitinho (PL-MG) discursa em apoio a PEC do fim da escala 6x1 | O POVO NEWS // NANDO MOURA CONTRA A ESCALA 6X1 // Escala 6x1: eu sou contra! // ESCALA 6X1 NÃO É VIDA! PRECISAMOS FALAR SOBRE ISSO // Escala 6x1: A Escravidão dos Tempos Modernos! // ESCALA 6X1: A VERDADE QUE NINGÉM TE CONTA // O fim da escala 6x1 é uma oportunidade política única (e o governo tá vacilando) // FIM DA ESCALA 6x1: por que esse tipo de trabalho tem que acabar? // tem como fazer a ESCALA 6X1 ser MENOS PIOR? // Como SAIR da ESCALA 6X1 para sempre // FIM DA ESCALA 6X1: ENTENDA A PROPOSTA ABSURDA QUE PODE DESTRUIR O BRASIL! // Essa escala 6x1 eu não aguento mais #shorts #drama // CEROL DAR SUA OPINIÃO SOBRE A ESCALA 6X1 // FIM DA ESCALA 6X1 // ESCALA 6X1: COMO É TRABALHAR NO SUPERMERCADO // Noubari - escala 6x1 // Fim da escala 6x1 // A escala 6x1 vai continuar e não haverá mudanças // A verdade sobre CLT e a escala 6x1(as empresas não querem que você saiba disso) // Escala 6x1: Por Que Não Tenho Escolha // A Escala 6x1 não é sua Verdadeira Inimiga // VOCÊ É CONTRA A ESCALA 6x1? 🤔 #shorts #short #escala6x1 #escala6x1não #6x1 #clt  #trabalho #viral // Estou revoltado! com essa escala 6x1 (O início de tudo) // É o fim da escala 6x1? // Escala 6x1 #shorts  #camaçari #6x1 #Escala6x1 // Escala 6x1 tem que acabar, os piores argumentos. // Escala 6x1 voce concorda? #6x1 #escala5x2 #clt #trabalho // Escala 6x1 ESCRAVIDÃO moderna! (Jovem fuja disso) // FIM DA ESCALA 6X1 #6x1 #escala6x1 #clt // ESCALA 6X1 É A ESCRAVIDÃO MODERNA DO SECULO XXI ?? [REACT] // Escala 6X1 #direito #escala6x1 #6x1 #bolsonaro #lula #direita #esquerda #trabalho #trabalhadores // FIM DA ESCALA 6x1 // Escala 6x1 part2 // O que não te contaram sobre o FIM DA ESCALA 6x1 // Escala 6x1 // ","transcriptions.txt","2351","471","36807","2024-11-13"
"PEC da escala 6x1: Nikolas Ferreira é cobrado por não assinar texto","O POVO","https://www.youtube.com/watch?v=qaPtUxBNz6U","Principal","Fim da escala 6x1: assinaturas necessárias protocolar PEC é atingida | SBT Brasil (13/11/24) // FIM DA ESCALA 6X1: ENTENDA COMO FUNCIONA O MODELO ATUAL E O QUE PODE MUDAR! // Feliciano defende trabalho ‘até a exaustão’ em comissão da Câmara // PEC pelo fim da escala 6x1 consegue assinaturas para ser protocolada na Câmara, diz Erika Hilton // Pressão pelo fim da escala 6x1 faz número de deputados a favor crescerem // Erika Hilton espera ter apoio do governo para fim da escala 6x1 | LINHA DE FRENTE // Vida Além do Trabalho: fim da escala 6x1 começou com debate da Constituição | Carlos Juliano Barros // PEC que proíbe escala 6x1 consegue 171 assinaturas | LIVE CNN // Escala 6x1: Com PEC, PSOL sai das cordas e consegue emplacar pauta antissistema, diz Josias de Souza // Campos Neto volta a fazer críticas à PEC contra escala 6x1: “Vai contra reforma que foi feita” // O que é a PEC da escala 6x1 // Escala 6x1: PEC deve ter as assinaturas suficientes nesta semana, diz deputada Erika Hilton // 🔥Erika Hilton pauta fim da escala 6x1 e bomba nas redes🔥Nikolas Ferreira massacrado por votar contra // Kim Kataguiri fala de escala 6x1 e governo Lula // PEC da escala 6x1: Nikolas Ferreira diz que proposta é &quot;terrivelmente elaborado&quot; l O POVO NEWS // PROPOSTA sobre o FIM da ESCALA 6X1 // 🔥Escala 6x1 escancara perversidade da direita🔥Nikolas é massacrado🔥Luana Piovani e famosos postam🔥 // ESCALA 6X1: PEC QUE QUER REDUZIR JORNADA DE TRABALHO CONSEGUE ASSINATURAS PARA SER PROTOCOLADO // Fim da escala 6x1: Proposta se aproxima de 150 assinaturas | O POVO NEWS // FIM DA ESCALA 6x1 PODE DESTRUIR A ECONOMIA BRASILEIRA // Fim da escala 6x1: Entenda projeto apresentado por Erika Hilton que agita redes sociais |O POVO NEWS // APÓS VIRALIZAR NAS REDES SOCIAIS, PROTESTOS POR FIM DA ESCALA 6X1 PASSA POR PRIMEIRO TESTE NAS RUAS // Escala 6x1 em Debate: Famosos como Leo Picon, Jade, Luana Piovani e Gil do Vigor opinam sobre a PEC // ","transcriptions.txt","2379","1330","96615","2024-11-10"
"NIKOLAS PODE TER USADO IA PARA ATACAR FIM DA ESCALA 6X1 | PLANTÃO","Meteoro Brasil","https://www.youtube.com/watch?v=1UMFk_cXS9I","Principal","Fim da escala 6x1 ganha pressão nas redes sociais e deve ser discutida no Congresso | Central Meio // FIM DA ESCALA 6x1 PODE DESTRUIR A ECONOMIA BRASILEIRA // ","transcriptions.txt","4925","211","40043","2024-11-11"
"Entenda a PEC que propõe o fim da escala 6x1","Meio","https://www.youtube.com/watch?v=6HY9yBjTmCA","Principal","Entenda o que propõe a PEC do fim da escala 6x1 | CNN NOVO DIA // 6x1: entenda o projeto que pede o fim da escala 6x1 | Leonardo Sakamoto // Especialista em Direito do Trabalho explica consequências do fim da escala 6x1 // 🚨ALERTA: FIM DA ESCALA 6x1 COLOCARÁ EM XEQUE OS EMPREGOS NO BRASIL? // O fim da escala 6x1 é uma oportunidade política única (e o governo tá vacilando) // A Escala 6x1 não é sua Verdadeira Inimiga // Estou revoltado! com essa escala 6x1 (O início de tudo) // ","transcriptions.txt","169","70","3127","2024-11-12"
"Fim da escala 6x1: PEC atinge assinaturas necessárias | Chega Mais Notícias (13/11/24)","SBT News","https://www.youtube.com/watch?v=lcA6277MtKg","Principal","Entenda o que propõe a PEC do fim da escala 6x1 | CNN NOVO DIA // Fim da escala 6x1: assinaturas necessárias protocolar PEC é atingida | SBT Brasil (13/11/24) // 6x1: entenda o projeto que pede o fim da escala 6x1 | Leonardo Sakamoto // Se o fim da escala 6x1 for aprovado a bolsa acaba? É o fim? // O Fim da Escala 6x1 vai Quebrar a Economia do Brasil // Fim da escala de 6x1: PEC tem mais de 130 assinaturas | CNN NOVO DIA // REFUTANDO QUEM É CONTRA O FIM DA ESCALA 6X1 | FÁCIL DEMAIS // Escala 6x1: PEC pelo fim da jornada de trabalho 6x1 chega a 134 assinaturas; são necessárias 171 // URGENTE: A Escala 6x1 vai acabar? // Especialista em Direito do Trabalho explica consequências do fim da escala 6x1 // A ESCALA 6X1 VAI ACABAR? // Escala 6x1 e os impactos na vida do trabalhador brasileiro | Papo Rápido | GNT // Léo Picon REAGE após &#39;massacre&#39; por fala sobre ESCALA 6x1 e diz que não é contra os trabalhadores // PEC do fim da escala 6x1: Manifestações de apoio devem acontecer em 6 capitais | O POVO NEWS // Humanizei a Escala 6x1 #shorts // Leo Picon volta a se pronunciar após polêmica da escala 6x1 // PEC do fim da escala 6x1 é uma farsa // FIM DA ESCALA 6X1 ! // O DESABAFO DE UM TRABALHADOR ESCALA 6X1 // ESCALA 6X1 NÃO É VIDA! PRECISAMOS FALAR SOBRE ISSO // ESCALA 6X1: A VERDADE QUE NINGÉM TE CONTA // Escala 6x1 - o que não te contaram // Essa escala 6x1 eu não aguento mais #shorts #drama // CLT e a ESCALA 6X1 - Fuja Disso! // A escala 6x1 vai continuar e não haverá mudanças // Escala 6x1 tem que acabar, os piores argumentos. // ESCALA 6X1 É A ESCRAVIDÃO MODERNA DO SECULO XXI ?? [REACT] // ","transcriptions.txt","5682","1935","266621","2024-11-13"
"Desabafo REAL Sobre a Escala 6x1: Vale a Pena?","mano deyvin","https://www.youtube.com/watch?v=oXyvpJmoRpA","Principal","O Fim da Escala 6 X 1 // O Fim da Escala 6x1 vai Quebrar a Economia do Brasil // a TRUE por trás da escala 6x1 // ESCALA 6X1: FIQUE RICO OU MORRA TENTANDO - DIRETO DO FIM DO MUNDO EP 08 // Fim da escala 6x1 vai &quot;quebrar a economia&quot; ? // A escala 6x1 vai acabar? Por que o assunto ganhou os holofotes // Refutando as mentiras de Nikolas Ferreira sobre o fim da escala 6x1 // O FIM DA ESCALA 6X1 EXPLICADO // TRABALHADOR EXAUSTO FAZ DESABAFO SOBRE ESCALA 6X1 // 🟡🔵 TRABALHO ESCALA 6x1. FEZ UM ESTRAGO NA MINHA VIDA // FIM DA ESCALA 6X1: ENTENDA A DISCUSSÃO! // VALE A PENA DESTRUIR SUA VIDA EM UM SUBEMPREGO? | ESCALA 6X1 // PAULO KOGOS TENTA EXPLICAR PORQUE É A FAVOR DA ESCALA 6X1 | Galãs Feios // ADEUS ESCALA 6X1, ADEUS SUPERMERCADO : PEDI DEMISSÃO !! // SENADOR DE EXTREMA DIREITA É CONTRA ESCALA 6X1 E A FAVOR DOS TRABALHADORES | Galãs Feios // Destruindo as mentiras de Kim Kataguire sobre o fim da escala 6x1 // ESCALA 6X1: A VERDADE QUE NINGÉM TE CONTA // ZEUS REAGE: O PROBLEMA SÃO VOCÊS E NÃO A ESCALA 6X1! // A DEPRESSÃO de Trabalhar na ESCALA 6x1 // A ESCALA 6x1 TEM QUE ACABAR - MURILO REAGE (Cortes da Live do Suco de Brasil) // NATHAN M.B.C. MANDA A REAL SOBRE A ESCALA DE TRABALHO 6X1 (VAT: MOVIMENTO VIDA ALÉM DO TRABALHO) // A maioria do povo brasileiro quer o fim da escala 6x1 // Do Sofrimento ao FIM da ESCALA 6x1 com Luide Matos e João Carvalho por Vida Além do Trabalho // DESABAFO DA ESCALA 6X1 // ESCALA 6X1: COMO É TRABALHAR NO SUPERMERCADO // 2 passos para TANKAR e SAIR da ESCALA 6x1 // ADEUS ESCALA 6X1: POR QUE EU PEDI DEMISSÃO DO MEU EMPREGO? // FIM DA ESCALA 6X1 // Escala 6x1 em discussão na Câmara: Como a esquerda vai desempregar ainda mais brasileiros. // Como sair da escala 6x1 e começar no Youtube (sem passar fome) // DESABAFO ESCALA 6X1: A REALIDADE DOS TRABALHADORES BRASILEIROS! | REACT. Luideverso // EU SAI DA ESCALA 6X1 (TROQUEI DE EMPREGO) // MAMAEFALEI FOI REFUTADO CONTRA A ESCALA 6X1 | Cortes do @MBLiveTV // SUPER XANDÃO REAGINDO A Escala 6x1  O Jovem quer SABER!!! // ","transcriptions.txt","3438","309","42348","2024-11-03"
"Fim da escala 6x1 virou tema &#39;incontornável&#39; no Congresso após pressão da sociedade, diz Boulos","UOL","https://www.youtube.com/watch?v=jSPDr0UwVtw","Principal","A PEC do FIM da ESCALA 6x1! // DEBATE QUENTE sobre a ESCALA 6X1 - ARTHUR DO VAL X ALFREDINHO // Escala 6x1: O Que Ninguém Te Conta Sobre Seus Direitos e o Que Pode Mudar em Breve! // Pressão pelo fim da escala 6x1 faz número de deputados a favor crescerem // Escala 6x1: debate sobre jornada de trabalho movimenta Congresso e redes sociais // Cortella e Alexandre Schwartsman analisam manifestações pelo fim da escala 6x1 // PROJETO DE FIM DA ESCALA 6X1 É IMPULSIONADO PELAS REDES SOCIAIS E PRESSIONA CONGRESSO NACIONAL // Escala 6x1: Deputado do PT defende jornada de 36 horas e propõe transição: &#39;Não tem custo&#39; // A escala 6x1 vai acabar? Por que o assunto ganhou os holofotes // Vida Além do Trabalho: fim da escala 6x1 começou com debate da Constituição | Carlos Juliano Barros // Debate sobre escala 6X1 reorganizou a classe trabalhadora, diz autora da PEC | CNN 360º // Único deputado do PL a apoiar PEC contra escala 6x1: &#39;Por ser da Erika Hilton, não vou analisar?&#39; // PEC que proíbe escala 6x1 consegue 171 assinaturas | LIVE CNN // ESSA É A VERDADE SOBRE O FIM DA ESCALA 6X1 // Escala 6x1: uma nova era de avaliação no trabalho ou risco à Justiça Trabalhista? // Argumentos contra o fim da escala 6x1 repetem falas já usadas // PEC da escala 6x1: Deputada Erika Hilton explica proposta em entrevista exclusiva | SBT News // Escala 6x1: Deputado do PL critica modelo e diz que debate &quot;não é questão de ideologia&quot; // Jussara Soares: PEC que determina fim da escala 6x1 pressiona direita e surpreende governo | CNN 360 // Escala 6x1: PEC deve ter as assinaturas suficientes nesta semana, diz deputada Erika Hilton // Escala 6x1: Vice-líder da oposição critica PEC de Erika Hilton e propõe pagamento por hora // PEC da escala 6x1: Nikolas Ferreira diz que proposta é &quot;terrivelmente elaborado&quot; l O POVO NEWS // Fim da escala 6x1 ganha pressão nas redes sociais e deve ser discutida no Congresso | Central Meio // ESCALA 6X1: PEC QUE QUER REDUZIR JORNADA DE TRABALHO CONSEGUE ASSINATURAS PARA SER PROTOCOLADO // O FIM DA ESCALA 6X1 (ninguém quer trabalhar😢) // A ESCALA 6X1 FOI ABOLIDA!?! #trabalho #clt #escala6x1 // PEC do fim da escala 6x1 é uma farsa // Senador Cleitinho (PL-MG) discursa em apoio a PEC do fim da escala 6x1 | O POVO NEWS // Erika Hilton rebate Nikolas Ferreira sobre escala 6x1: &#39;Quem tem coragem de debater assina a PEC&#39; // Entrevista: Nikolas Ferreira e a escala 6x1 // Escala 6x1: Centrão tenta derrubar ofensiva pelo fim do modelo com &#39;PEC do Ganho por Hora&#39; | Matais // PEC de Erika Hilton (PSOL/SP) pelo fim da escala 6x1 avança; pressão sobre deputados é fundamental // Fim da escala 6x1: Entenda projeto apresentado por Erika Hilton que agita redes sociais |O POVO NEWS // Escala 6x1 - o que não te contaram // Escala 6x1 em Debate: Famosos como Leo Picon, Jade, Luana Piovani e Gil do Vigor opinam sobre a PEC // TREZOITAO É A FAVOR DA ESCALA 6X1? // FIM DA ESCALA 6X1: PROJETO OU PROPAGANDA? | Magna Carta | AO VIVO // MAMÃE FALEI DEBATE CONTRA ESCALA 6X1 | CORTES // Nikolas Ferreira expõe verdade por trás do Fim da Escala 6x1 de Erika Hilton do Psol // Escala 6x1 em discussão na Câmara: Como a esquerda vai desempregar ainda mais brasileiros. // Fim da escala 6x1 e o Deputado Marco Feliciano // ESCALA 6X1: O INESPERADO DEBATE ENTRE COMUNISTA E DEPUTADO CONSERVADOR | CORTES // ","transcriptions.txt","1272","422","33031","2024-11-18"
"ESCALA 6x1: A ROTINA QUE DESTRÓI MILHÕES de BRASILEIROS (Vídeo Irrefutável)","luideverso","https://www.youtube.com/watch?v=c1fOSMSXqi4","Principal","O Fim da Escala 6 X 1 // ninguém aguenta mais a ESCALA 6x1 // Se o fim da escala 6x1 for aprovado a bolsa acaba? É o fim? // O Fim da Escala 6x1 vai Quebrar a Economia do Brasil // Como o fim da escala 6x1 pode impactar o mercado de trabalho // A escala 6x1 vai acabar? Por que o assunto ganhou os holofotes // Igão DISCUTE sobre FIM DA ESCALA 6X1 com PSIQUIATRA // TRABALHADOR EXAUSTO FAZ DESABAFO SOBRE ESCALA 6X1 // Fim da escala 6x1 | Parte 1 // Por que a proposta do fim da escala 6x1 é a 4x3? // A ESCALA 6x1 VAI ACABAR? | PAUTA QUENTE // 🟡🔵 TRABALHO ESCALA 6x1. FEZ UM ESTRAGO NA MINHA VIDA // FIM DA ESCALA 6X1: ENTENDA A DISCUSSÃO! // PEC do fim da escala 6x1: Manifestações de apoio devem acontecer em 6 capitais | O POVO NEWS // Feliciano sobre Escala 6x1: &quot;Nos EUA, todos trabalham até a exaustão pra ver prosperidade e riqueza&quot; // Fim da escala 6x1 | Entenda agora // O fim da Escala 6x1: Como essa mudança afeta Pequenos Empresários e Trabalhadores // Humanizei a Escala 6x1 #shorts // PEC pelo fim da escala 6x1 atinge assinaturas e já pode tramitar no Congresso // Quer ARRUINAR a sua vida? Trabalhe na ESCALA 6X1 // ESCALA 6X1 e fim do concurso de CARREIRA! Concurso CLT agora! // Se o fim da ESCALA 6x1 for aprovado a BOLSA acaba? É o fim? // PEC do fim da escala 6x1 é uma farsa // FIM DA ESCALA 6x1 PODE DESTRUIR A ECONOMIA BRASILEIRA // ESCALA 6x1: Será o fim desse modelo de trabalho? // Escala 6x1: A Escravidão dos Tempos Modernos! // A ESCALA 6x1 TEM QUE ACABAR - MURILO REAGE (Cortes da Live do Suco de Brasil) // Afinal, o que é a Escala 6x1 ? #noticias #direitotrabalho #escala6x1 #6x1 #pec  #direitotrabalhador // O FIM DA ESCALA 6X1 É UMA UTOPIA NO BRASIL! // FIM DA ESCALA 6X1 // DESABAFO DA ESCALA 6X1 // ZEUS REAGE: A ESCALA 6X1 VAI ACABAR COM A BOLSA // 2 passos para TANKAR e SAIR da ESCALA 6x1 // ESCALA 6x1 #shorts // Escala 6x1 em discussão na Câmara: Como a esquerda vai desempregar ainda mais brasileiros. // Fim da escala 6x1 e o Deputado Marco Feliciano // Como sair da escala 6x1 e começar no Youtube (sem passar fome) // A escala 6x1 tem que acabar no BOSTIL! // FIM DA ESCALA 6x1 // TRABALHAR NA ESCALA 6X1 VAI ARRUINAR SUA VIDA? (1 DE 2) - REACT @mbcnate // DESABAFO ESCALA 6X1: A REALIDADE DOS TRABALHADORES BRASILEIROS! | REACT. Luideverso // Fim da escala 6X1 // ESCALA 6X1 É A ESCRAVIDÃO MODERNA DO SECULO XXI ?? [REACT] // Escala 6X1 #direito #escala6x1 #6x1 #bolsonaro #lula #direita #esquerda #trabalho #trabalhadores // Desabafo de um jovem trabalhador na escala 6x1 // #noticias #escala #6x1 #pec #constituicaofederal #fim // Fim da escala 6x1 // ","transcriptions.txt","14003","1540","133700","2024-06-27"
"Léo picon fala a favor da ESCALA 6X1","Ismael","https://www.youtube.com/watch?v=vjpNwM2oWIE","Principal","Léo Picon REAGE após &#39;massacre&#39; por fala sobre ESCALA 6x1 e diz que não é contra os trabalhadores // Leo Picon volta a se pronunciar após polêmica da escala 6x1 // Léo Picon defende escala 6x1 e internautas relembram oq ele fez com Brino, Tiago responde Petry // ","transcriptions.txt","74650","3247","694195","2024-11-14"
"Escala 6x1: Nikolas passa recibo e mostra debate da PEC como derrota do extremismo, diz  Sakamoto","UOL","https://www.youtube.com/watch?v=Hw7XnDyIhio","Principal","FIM DA ESCALA 6X1: ELES ESTÃO DESESPERADOS!!! // Entrevista: Nikolas Ferreira e a escala 6x1 // ","transcriptions.txt","19011","3036","374546","2024-11-12"
"O FIM DA JORNADA 6x1... TUDO O QUE VOCÊ PRECISA SABER!","Marcelo Brigadeiro","https://www.youtube.com/watch?v=5ss4npT20MU","Principal","6x1: entenda o projeto que pede o fim da escala 6x1 | Leonardo Sakamoto // O Fim da Escala 6 X 1 // Se o fim da escala 6x1 for aprovado a bolsa acaba? É o fim? // O Fim da Escala 6x1 vai Quebrar a Economia do Brasil // a TRUE por trás da escala 6x1 // Redução da jornada de trabalho: PEC que acaba com a escala 6X1 está em debate // FIM DA ESCALA DE TRABALHO 6x1: o que está sendo proposto? Como começou o movimento? ESTADÃO EXPLICA // Fim da escala de 6x1: PEC tem mais de 130 assinaturas | CNN NOVO DIA // A escala 6x1 vai acabar? Por que o assunto ganhou os holofotes // Debate sobre escala 6X1 reorganizou a classe trabalhadora, diz autora da PEC | CNN 360º // Especialista em Direito do Trabalho explica consequências do fim da escala 6x1 // Redução da jornada de trabalho: PEC que acaba com a escala 6X1 está em debate // Escala 6x1: Redução de jornada é tendência, mas, por meio de lei, eleva informalidade, diz Landim // Escala 6x1: uma nova era de avaliação no trabalho ou risco à Justiça Trabalhista? // TRABALHADOR EXAUSTO FAZ DESABAFO SOBRE ESCALA 6X1 // Argumentos contra o fim da escala 6x1 repetem falas já usadas // FIM DA ESCALA 6x1: Any Ortiz explica sua posição sobre PEC | Timeline // FIM DA ESCALA 6X1: ENTENDA A DISCUSSÃO! // PEC do fim da escala 6x1: Manifestações de apoio devem acontecer em 6 capitais | O POVO NEWS // Feliciano sobre Escala 6x1: &quot;Nos EUA, todos trabalham até a exaustão pra ver prosperidade e riqueza&quot; // O fim da Escala 6x1: Como essa mudança afeta Pequenos Empresários e Trabalhadores // Alexandre Garcia: PEC que acaba com escala de trabalho 6x1 é burra // Fim da escala 6x1? PEC propõe diminuição da jornada de trabalho // Fim da escala 6x1: Entenda como funciona o modelo atual e o que PEC pode mudar // PEC pelo fim da escala 6x1 atinge assinaturas e já pode tramitar no Congresso // Se o fim da ESCALA 6x1 for aprovado a BOLSA acaba? É o fim? // Escala 6x1 - O Jovem quer SABER!!! // PEC do fim da escala 6x1 é uma farsa // Escala 6x1: Como surgiu o debate sobre o assunto? #trabalhadores #6x1 #direitostrabalhistas // NANDO MOURA CONTRA A ESCALA 6X1 // ESCALA 6X1: A VERDADE QUE NINGÉM TE CONTA // POR QUE acabar com a JORNADA 6x1? Advogado comenta A PEC DO FIM DA ESCALA 6X1 // FIM DA ESCALA 6x1: por que esse tipo de trabalho tem que acabar? // Fiz uma comparação da escala 6X1 do trabalhador com a do político. // A maioria do povo brasileiro quer o fim da escala 6x1 // MAMÃE FALEI DEBATE CONTRA ESCALA 6X1 | CORTES // FIM DA ESCALA 6X1 // Cleitinho confronta aliados e quer Fim da Escala 6x1- Nikolas Ferreira rebate críticas // Marco Feliciano é contra o fim da escala 6x1 // Escala 6x1 tem que acabar, os piores argumentos. // Escala 6x1 voce concorda? #6x1 #escala5x2 #clt #trabalho // EU SAI DA ESCALA 6X1 (TROQUEI DE EMPREGO) // Escala 6X1 #direito #escala6x1 #6x1 #bolsonaro #lula #direita #esquerda #trabalho #trabalhadores // ","transcriptions.txt","20852","5220","225493","2024-11-10"
